{
  "page_index": 0,
  "route": {
    "ocr": {
      "reason": "missing_text"
    }
  },
  "width": 1280,
  "height": 2021,
  "blocks": [
    {
      "bbox": {
        "x": 97.0,
        "y": 106.0,
        "width": 1125.0,
        "height": 1739.0
      },
      "confidence": 0.9900001,
      "reading_order": 0,
      "lines": [
        {
          "bbox": {
            "x": 519.0,
            "y": 106.0,
            "width": 214.0,
            "height": 33.0
          },
          "confidence": 0.99,
          "reading_order": 0,
          "words": [
            {
              "text": "ΜΙΝΩΣ",
              "normalized_text": "ΜΙΝΩΣ",
              "bbox": {
                "x": 519.0,
                "y": 106.0,
                "width": 214.0,
                "height": 33.0
              },
              "confidence": 0.99,
              "reading_order": 0
            }
          ]
        },
        {
          "bbox": {
            "x": 1124.0,
            "y": 115.0,
            "width": 98.0,
            "height": 30.0
          },
          "confidence": 0.99,
          "reading_order": 1,
          "words": [
            {
              "text": "320 a",
              "normalized_text": "320 a",
              "bbox": {
                "x": 1124.0,
                "y": 115.0,
                "width": 98.0,
                "height": 30.0
              },
              "confidence": 0.99,
              "reading_order": 0
            }
          ]
        },
        {
          "bbox": {
            "x": 100.0,
            "y": 187.0,
            "width": 1007.0,
            "height": 38.0
          },
          "confidence": 0.99,
          "reading_order": 2,
          "words": [
            {
              "text": "λήνων καὶ βαρβάρων, οὐκ ἔστιν οἵτινες ἀπέχονται συμποσίων",
              "normalized_text": "λήνων καὶ βαρβάρων, οὐκ ἔστιν οἵτινες ἀπέχονται συμποσίων",
              "bbox": {
                "x": 100.0,
                "y": 187.0,
                "width": 1007.0,
                "height": 38.0
              },
              "confidence": 0.99,
              "reading_order": 0
            }
          ]
        },
        {
          "bbox": {
            "x": 100.0,
            "y": 237.0,
            "width": 1016.0,
            "height": 38.0
          },
          "confidence": 0.99,
          "reading_order": 3,
          "words": [
            {
              "text": "καὶ ταύτης τῆς παιδιᾶς, οὗ ἔστιν οἶνος, ἄλλοι ἢ Κρῆτες καὶ",
              "normalized_text": "καὶ ταύτης τῆς παιδιᾶς, οὗ ἔστιν οἶνος, ἄλλοι ἢ Κρῆτες καὶ",
              "bbox": {
                "x": 100.0,
                "y": 237.0,
                "width": 1016.0,
                "height": 38.0
              },
              "confidence": 0.99,
              "reading_order": 0
            }
          ]
        },
        {
          "bbox": {
            "x": 100.0,
            "y": 288.0,
            "width": 1009.0,
            "height": 37.0
          },
          "confidence": 0.99,
          "reading_order": 4,
          "words": [
            {
              "text": "Λακεδαιμόνιοι δεύτεροι, μαθόντες παρὰ Κρητῶν. ἐν Κρήτῃ",
              "normalized_text": "Λακεδαιμόνιοι δεύτεροι, μαθόντες παρὰ Κρητῶν. ἐν Κρήτῃ",
              "bbox": {
                "x": 100.0,
                "y": 288.0,
                "width": 1009.0,
                "height": 37.0
              },
              "confidence": 0.99,
              "reading_order": 0
            }
          ]
        },
        {
          "bbox": {
            "x": 99.0,
            "y": 338.0,
            "width": 1050.0,
            "height": 37.0
          },
          "confidence": 0.99,
          "reading_order": 5,
          "words": [
            {
              "text": "δὲ εἷς οὗτός ἐστι τῶν ἄλλων νόμων οὓς Μίνως ἔθηκε, μὴ 5",
              "normalized_text": "δὲ εἷς οὗτός ἐστι τῶν ἄλλων νόμων οὓς Μίνως ἔθηκε, μὴ 5",
              "bbox": {
                "x": 99.0,
                "y": 338.0,
                "width": 1050.0,
                "height": 37.0
              },
              "confidence": 0.99,
              "reading_order": 0
            }
          ]
        },
        {
          "bbox": {
            "x": 100.0,
            "y": 388.0,
            "width": 1008.0,
            "height": 37.0
          },
          "confidence": 0.99,
          "reading_order": 6,
          "words": [
            {
              "text": "συμπίνειν ἀλλήλοις εἰς μέθην. καίτοι δῆλον ὅτι ἃ ἐνόμιζεν",
              "normalized_text": "συμπίνειν ἀλλήλοις εἰς μέθην. καίτοι δῆλον ὅτι ἃ ἐνόμιζεν",
              "bbox": {
                "x": 100.0,
                "y": 388.0,
                "width": 1008.0,
                "height": 37.0
              },
              "confidence": 0.99,
              "reading_order": 0
            }
          ]
        },
        {
          "bbox": {
            "x": 100.0,
            "y": 438.0,
            "width": 1006.0,
            "height": 37.0
          },
          "confidence": 0.99,
          "reading_order": 7,
          "words": [
            {
              "text": "καλὰ εἶναι, ταῦτα νόμιμα ἔθηκεν καὶ τοῖς αὑτοῦ πολίταις.",
              "normalized_text": "καλὰ εἶναι, ταῦτα νόμιμα ἔθηκεν καὶ τοῖς αὑτοῦ πολίταις.",
              "bbox": {
                "x": 100.0,
                "y": 438.0,
                "width": 1006.0,
                "height": 37.0
              },
              "confidence": 0.99,
              "reading_order": 0
            }
          ]
        },
        {
          "bbox": {
            "x": 100.0,
            "y": 487.0,
            "width": 1013.0,
            "height": 38.0
          },
          "confidence": 0.99,
          "reading_order": 8,
          "words": [
            {
              "text": "οὐ γάρ που, ὥσπερ γε φαῦλος ἄνθρωπος, ὁ Μίνως ἐνόμιζεν",
              "normalized_text": "οὐ γάρ που, ὥσπερ γε φαῦλος ἄνθρωπος, ὁ Μίνως ἐνόμιζεν",
              "bbox": {
                "x": 100.0,
                "y": 487.0,
                "width": 1013.0,
                "height": 38.0
              },
              "confidence": 0.99,
              "reading_order": 0
            }
          ]
        },
        {
          "bbox": {
            "x": 1113.0,
            "y": 487.0,
            "width": 41.0,
            "height": 38.0
          },
          "confidence": 0.99,
          "reading_order": 9,
          "words": [
            {
              "text": "b",
              "normalized_text": "b",
              "bbox": {
                "x": 1113.0,
                "y": 487.0,
                "width": 41.0,
                "height": 38.0
              },
              "confidence": 0.99,
              "reading_order": 0
            }
          ]
        },
        {
          "bbox": {
            "x": 97.0,
            "y": 537.0,
            "width": 1008.0,
            "height": 37.0
          },
          "confidence": 0.99,
          "reading_order": 10,
          "words": [
            {
              "text": "μὲν ἕτερα, ἐποίει δὲ ἄλλα παρ᾽ ἃ ἐνόμιζεν· ἀλλὰ ἦν αὕτη",
              "normalized_text": "μὲν ἕτερα, ἐποίει δὲ ἄλλα παρ᾽ ἃ ἐνόμιζεν· ἀλλὰ ἦν αὕτη",
              "bbox": {
                "x": 97.0,
                "y": 537.0,
                "width": 1008.0,
                "height": 37.0
              },
              "confidence": 0.99,
              "reading_order": 0
            }
          ]
        },
        {
          "bbox": {
            "x": 97.0,
            "y": 587.0,
            "width": 1010.0,
            "height": 38.0
          },
          "confidence": 0.99,
          "reading_order": 11,
          "words": [
            {
              "text": "ἡ συνουσία ὥσπερ ἐγὼ λέγω, διὰ λόγων ἐπὶ παιδείᾳ εἰς",
              "normalized_text": "ἡ συνουσία ὥσπερ ἐγὼ λέγω, διὰ λόγων ἐπὶ παιδείᾳ εἰς",
              "bbox": {
                "x": 97.0,
                "y": 587.0,
                "width": 1010.0,
                "height": 38.0
              },
              "confidence": 0.99,
              "reading_order": 0
            }
          ]
        },
        {
          "bbox": {
            "x": 99.0,
            "y": 636.0,
            "width": 1009.0,
            "height": 37.0
          },
          "confidence": 0.99,
          "reading_order": 12,
          "words": [
            {
              "text": "ἀρετήν. ὅθεν δὴ καὶ τοὺς νόμους τούτους ἔθηκε τοῖς αὑτοῦ",
              "normalized_text": "ἀρετήν. ὅθεν δὴ καὶ τοὺς νόμους τούτους ἔθηκε τοῖς αὑτοῦ",
              "bbox": {
                "x": 99.0,
                "y": 636.0,
                "width": 1009.0,
                "height": 37.0
              },
              "confidence": 0.99,
              "reading_order": 0
            }
          ]
        },
        {
          "bbox": {
            "x": 98.0,
            "y": 684.0,
            "width": 1016.5,
            "height": 41.0
          },
          "confidence": 0.99,
          "reading_order": 13,
          "words": [
            {
              "text": "πολίταις, δι᾽ οὓς ἥ τε Κρήτη τὸν πάντα χρόνον εὐδαιμονεῖ",
              "normalized_text": "πολίταις, δι᾽ οὓς ἥ τε Κρήτη τὸν πάντα χρόνον εὐδαιμονεῖ",
              "bbox": {
                "x": 98.0,
                "y": 684.0,
                "width": 1016.5,
                "height": 41.0
              },
              "confidence": 0.99,
              "reading_order": 0
            }
          ]
        },
        {
          "bbox": {
            "x": 1114.5,
            "y": 684.0,
            "width": 30.5,
            "height": 41.0
          },
          "confidence": 0.99,
          "reading_order": 14,
          "words": [
            {
              "text": "5",
              "normalized_text": "5",
              "bbox": {
                "x": 1114.5,
                "y": 684.0,
                "width": 30.5,
                "height": 41.0